patent_number,text,promising
10602244,access base connection detection determine information location monitoring network object period point region sensor station system type,0
8595857,classification computer device identity management message method query response system user,0
9443002,analysis computer decision display event method outcome probability result selection set system,1
9411934,alarm configuration display equipment list response room selection signal station system type user,1
10891731,body classification code content function image indication injection instruction list network patient pixel processing processor region sensor system target treatment type value,0
10878511,amount delivery method party provider record service system view,0
10755808,access combination container device medication method rate system,0
8574190,accordance apparatus delivery determine embodiment information invention monitor parameter patient pump system,1
9898580,apparatus method patient user,0
8890656,caregiver device example health interface message monitoring processing range station surface system wireless,1
10152582,access application code computer generate identity information mechanism medium method patient server system use,0
10758675,delivery dosage embodiment insulin method parameter person system user,0
10881793,amount delivery dosage embodiment insulin method parameter person response system user,0
10593423,data engine generate information interest language mechanism model patient portion process processing record request response structure text,1
9414747,basis model system technique time tissue,0
10204427,area data image method model network object reference set system value,1
9928342,attribute client collection device engine event flow healthcare hospital information item machine method model plurality provider recommendation server system tag,1
9953248,analysis apparatus circuit communication control device feature image indication information memory method processor server transmit,0
11039748,action activity cloud device embodiment end health information location model point response security sensor server source state system,0
10912534,computer detector device housing interface measurement medium method output patient processor property record response result signal system unit vessel,0
10158928,circuitry fluid information projection region sample surface transmission unit,0
10278653,alert detection device event heart management method process system target,1
10929510,accordance care configuration control device embodiment environment identifier information memory patient plan provide reference remote sensor server system technique,0
10861594,body code computer device environment food function information memory part processor product recommendation sensor system user,0
10201308,cell communication device disease display health information management measure measurement monitoring motion patient screen sensor server state system technology transmission type unit volume wireless,0
10201293,acquisition comparison contact generation health interest method module monitoring motion pattern reference region representation sensor sequence subject system time,0
9592380,area body circuit control controller determine electrode element generate level output state stimulation system target value,0
8774889,algorithm basis cause computer device input measurement memory method monitoring patient pattern perform processor product program reference sensor set store system time,0
8585604,care condition example instruction medication module parameter patient prescription response schedule sensor system therapy,1
9168418,care computer condition determine device entity evaluation exercise hand health interest mode order patient provider system therapy time use user,1
10970785,cause claim code determine embodiment emergency instruction memory processing processor service status system task technique,0
8788291,distribution method reference set system time value,0
11132361,computer database generate input interface label language machine memory output processor program query record system user value vector,0
9913993,condition device disclosure memory method operation parameter patient prescription signal source system transmit,1
9553727,database determination device health identification identity information management message module perform record request response secure server session transaction user,0
10811129,accordance configuration delivery device file insulin parameter plurality profile pump rule software technique,0
11198037,activity care disease exercise field health invention management method order patient program technique training treatment user,0
9898789,embodiment health invention method model module number operation platform program service system,1
10105573,activity amount aspect case control display exercise indicator information input invention method order state time type unit user,0
9430615,contact detection device example function hand heart monitoring rate user,0
10902947,algorithm connection control database disclosure embodiment factor infusion machine method monitor network patient pump record resonance system,0
11071372,care communication determine device event feedback health interface method movement position processor sensor state system user value,0
10642955,base communication computer database device feedback health image level medium method plurality processor risk set time user,0
10878512,method part product record request system technology,1
9770169,device embodiment health measure method monitor patient structure surface system,0
10658075,computer database health instruction measure medium method plurality record software system use,0
9514282,algorithm amount container control detection event example information method state time,0
11177023,candidate computer entity event form information invention object plurality processor product program record source system,0
10734106,area communication database device engine interface method network pharmacy plurality prescription system,0
10685089,care communication configuration evaluation generate mechanism mode operation parameter patient plan plurality response result selection system,0
10528702,analysis communication determination determine generate information interest mechanism mode multi patient plurality record result treatment,0
9342654,image location number pixel processor protocol quality request response server system text,0
9026190,cell communication computer detection device element heart memory method monitoring parameter surface system use,1
8838637,communication computer database document embodiment imaging language memory method processor protocol query result step system,0
10225086,cause computer image instruction medium memory module process processor representation sample storage store system,1
8948793,communication database device message method period response server store system time wireless,1
10335464,administration condition data determination device disease evaluation information insulin invention recommendation set step structure subject treatment use,0
10922944,activity aspect assessment care caregiver cause detection information instruction machine method monitoring patient processor response state status system,0
10643741,access assessment interface method performance platform plurality recommendation report request response system user,0
11049020,apparatus embodiment food group machine method plurality substance,0
9910047,condition disease disorder entity insulin method subject type,0
10713287,apparatus document event index interface label location method multi query response result search text user value,0
10448869,adherence administration care context criterion method patient plurality sample selection test use user,0
9710221,alarm application care communication condition control event health input interface monitor output parameter patient portion process risk room software system time user volume,0
9757042,base blood body determine feature invention measurement parameter patient pressure process sensor surface system time value volume,0
8489418,condition disease example interface method patient plurality processor profile provide recommendation selection store system user,1
10347382,agent apparatus application client data device health information location method part region sample server system,0
11183292,basis criterion device display embodiment function health image information invention medium method network order risk rule study system user,0
8803690,application computer context event information interface level memory patient store structure system time,0
11043302,connection data device display module monitor patient plurality power sensor unit wireless,0
9933849,computer context determination device image interest level location method order pixel product program region user value,0
9072903,computer device feedback method patient procedure protocol stimulation system,0
8784209,display health method program status system user,0
9872622,change display image location measure processor resonance temperature,0
11096582,access comparison determine device embodiment health indication measurement method parameter patient system technology,0
11160504,condition device electrode information input operation plurality processor sensor sequence state user,0
9101270,apparatus health image invention method monitoring part state system treatment,1
10872699,case cloud multi order outcome patient,0
9147043,application case condition cost device diagnosis drug health management order outcome patient risk service substance system treatment,0
11040159,algorithm apparatus device event method pressure treatment use,0
10395055,access apparatus circuitry control disclosure generate identity indication interest measurement method platform prescription process user,0
9760554,content display language processing technique text,0
9999395,action activity apparatus collection determination location method unit user,0
11205504,device event generate health information machine method model person population provider score state step system time,0
9652592,comparison compliance computer condition determination device diagnosis embodiment information network plan report sensor storage treatment use user,0
9629581,apparatus combination determine device information input method monitoring movement position sensor,0
10565351,analysis code criterion determine device disclosure document generation information node output plurality rule structure system,0
9144384,apparatus application communication condition method monitoring patient request software system,0
9898156,change circuitry computer device image indication input interface level location method order point position product program reference user,0
8700432,access body camera capture communication database device diagnosis display image location marker method network processor record system tag,1
9355214,alarm communication determine device event facility information message monitor network notification patient plurality rate system,1
10172562,body care control controller display embodiment function health information invention method range reference set unit user value,1
10330667,body device interface method monitoring sample system target test time,1
9864837,event map node process protocol quality record storage store system time,0
11164680,device information method network provider response result screen server system test,0
10885134,access control database field identification information mechanism record rule system,0
10143401,activity change collection detection device food interaction management measure measurement method recommendation sensor site subject,1
10163322,communication embodiment equipment patient system,0
11195281,area disease image index map method reference state system target tissue value,0
10755810,analysis application context determine disease imaging information level method performance process service support system technology use,0
10950353,disease method model patient plurality range state system time value,0
10987013,generate image input measurement mechanism network output system value vector,0
10524659,apparatus body computer condition control determination device disease information medium method plurality processor range signal transmit,0
9558648,alarm apparatus area care condition dispenser example hand health method mode module monitoring patient sensor signal station,1
9867513,function surface use user,1
11010556,action agent database indication list method object patient plurality reference text,0
8588964,computer container device form interaction label medication patient product program provide secure sensor storage system user,0
11107574,application communication element event interface management medication order pharmacy profile record status system user,0
10410750,assessment communication computer decision device embodiment event form function identification information invention measure medium model monitoring patient platform plurality prediction risk support system term time,0
10576327,circuit communication connection device display exercise information interface measure memory method processor result sensor store type,1
9114054,apparatus caregiver communication device function monitoring network operation patient pressure report station system technology therapy use,1
9918637,communication data device identification identity input memory monitoring patient process processing processor protocol sensor system,0
10368701,dispenser,0
10045899,delivery embodiment medication module plurality surface system,0
10397751,apparatus body communication condition device health housing identity method module monitoring part person position system unit,1
10368747,association communication criterion device indicator level management processor system wireless,0
11002747,blood care compliance device hospital instrument invention location method point protocol quality sample system type use,0
10236081,change circuitry communication condition control device display health information interface management method processor result sensor server service state user,0
8935155,application classification content context determine information language mechanism method part processing report text unit,1
8823510,control dosage embodiment field generate information instruction invention prescription processor provide sensor station system time unit,1
8990260,care element health level monitoring part patient process profile provider station structure system,0
10032060,area body circuit communication computer examination feature image output part patient portion product program reference region relationship surface system,0
9265903,device display group information interface parameter patient section status system user,0
9053213,candidate database image measure plurality quality result rule step store,0
10692595,database drug environment infusion management message process pump system,1
10937552,accordance condition embodiment image patient plan recommendation report request service system treatment,0
10860528,detection example file method series source system type,0
11166679,detection device event information method monitoring patient system,0
9764087,control delivery device drug flow fluid infusion model parameter plurality point prediction profile pump structure system time,1
8799022,apparatus communication database identification identity information location method network number order output record rule secure server transaction transmission,1
10706592,acquisition application assessment contrast function image imaging information invention method motion patient system technique time,0
10552969,analysis cancer computer disease example image information interest measure medium method region response structure system tissue treatment,0
9600849,access computer content input response user,0
9836580,claim condition diagnosis health method provider system,1
10932745,acquisition disclosure image method plan radiation subject system,0
9412047,apparatus body candidate control display image information model position processing report selection storage unit,0
9971874,action adherence detection determination device indication medication method monitoring motion response segment sensor signal user,0
10542075,accordance apparatus cause computer configuration device indication information method monitoring patient product program,0
10559378,image item memory method object pixel plurality storage system,0
11107590,acquisition cloud data diagnosis facility healthcare image information method period plurality request response server system time,0
10924553,configuration device event information interface location management performance remote server software view,0
10706963,care decision display embodiment health list location method notification order provider query response service system user,0
11199904,brain classification computer device display element feature generate instruction interface memory method model monitoring perform platform plurality process processor response sensor signal task time vector,0
10672158,aspect device display embodiment information interaction object processor selection target,0
10510028,apparatus computer context method order plurality product program task type unit value,0
10629298,acquisition apparatus container detector device identification information medication member method plurality presence storage,0
10347370,database embodiment event index level location method patient plurality processor range sequence source storage time unit view,0
10600512,body communication computer device disclosure embodiment facility image imaging network operation part patient period program result system time value,0
10542940,disease group health model patient plurality prediction record risk,0
10366780,candidate database information method patient process question system treatment,0
10448898,condition distribution embodiment health method parameter subject system,0
11116986,communication device disclosure generate generation method period plurality stimulation system test therapy time tool,0
10292597,apparatus blood determine function measure measurement method parameter plurality pressure value,0
9460700,equipment event exercise machine motion movement process sequence signal structure system type user,1
9953453,condition determine feature image map motion pattern plurality processor system time user view,0
9173617,contrast form image interest method protocol radiation reference region step subject system volume,0
9072489,apparatus control display feature image input invention method part point position processing target unit,1
10709424,blood change controller embodiment end measurement method pressure sensor system unit,0
10643747,access action analysis communication database device engine identification instrument interface method model order plurality portion service,0
10653316,application cloud communication component cost health method monitoring network process protocol remote signal system wireless,0
11100683,application display effect image interaction list method mode model output parameter pixel processing system,0
11160472,association event monitor movement notification pressure sensor system,0
10524720,blood circuit condition flow health measurement patient plurality range response risk sensor substance system tissue,0
11164596,analysis evaluation generate health marker memory operation processor result sensor store system user,0
10679345,feature image interest machine mechanism model network portion process region report text,1
9615804,analysis application evaluation field generation image information method modality parameter value,1
10861592,drug environment infusion network number plurality pump software store system time,1
10028700,body determination element image method pixel plurality portion system tissue,0
10045702,camera configuration content determination evaluation feature frame image information interface invention remote sign signal subject unit,0
9524480,dispenser hand indicator invention item mechanism order person procedure support system task,0
9928451,accordance apparatus area computer information medium method processing record result storage unit,0
9986946,application body control determine device function method order patient plurality point record representation surface target tool,0
11205507,device display input instrument interface intervention measurement method patient pressure procedure processing representation response screen system user vessel,0
9830800,area compliance condition determine dispenser frequency hand healthcare hospital member monitoring plurality protocol provider room sensor sequence signal station system tag,0
10861295,apparatus communication configuration controller detector facility identifier interface location message patient plurality support surface,0
10831866,care delivery feedback invention message method order provider schedule service system task,0
10360588,action distribution healthcare monitor party program provider system user,0
11152111,area caregiver computer determine facility form healthcare identification location plurality system tag time,0
11106818,application client cloud code database device example identification information interface management method patient record security server system time,0
9864746,association candidate computer entity form information invention object processor product program record source system,1
10057732,alert cause circuitry content device healthcare information message plurality station system type user,0
9069886,apparatus control display invention level mode operation order plurality procedure selection storage store unit,1
9380982,alarm condition device embodiment input monitor patient processor response signal system,1
10175254,change communication control controller detection generate indicator measurement method patient processor response sensor signal source system temperature transmit user,0
10383553,analysis application collection device element function input interaction interface invention method system task test,1
9489818,apparatus location module status support system unit,1
10169530,cancer event invention method number patient,0
9131923,agent analysis base blood comparison contrast detection device display flow image map method range region selection time unit vessel,0
11031133,computer feature message patient text therapy,0
10096137,alarm display module monitor parameter patient representation system value,0
10010284,control criterion disorder display generate health image input measure process processor reference response series system test time,0
8972460,analysis computer database embodiment entity level management method model product program relationship result structure system,1
11101034,access action aspect device embodiment entity information interaction parameter processor selection target,0
10912895,body determine end event information injection measure member method processor system,0
9576391,amount apparatus display image information method motion point relationship time,1
10347020,dataset device embodiment invention method,0
10943701,drug embodiment interaction intervention model patient plurality point report representation,0
9245091,comparison heart information location model motion system time,1
9693932,drug level measurement method number order patient pharmacy pill prescription product substance system technology volume,0
10423453,access method system use,0
9965594,communication dispenser information system,0
10010252,apparatus area blood display index measurement position pressure unit value,0
10058279,activity amount device display image measurement method period program range step system time user,1
11075487,device end invention monitoring patient power system transmission unit use,0
10782373,component data example image map method model multi process processing system,0
10733566,account case condition diagnosis factor indicator location machine method model patient prediction probability query score system view,0
11037260,access emergency information interface location memory processor response server system user,0
9687214,acquisition case control device group location measurement method mode notification output processing program result selection signal surface unit,0
9043345,compliance condition content engine event health input interface management notification output plurality store structure system,0
9098901,activity device entity information input interest method model parameter process processing property radiation representation signal,0
10758161,assessment assistance device display information location monitoring patient protocol station therapy use,0
11056232,activity amount analysis communication comparison computer disclosure embodiment facility infusion medication network patient program pump result session system treatment value,0
11134921,blood device display flow generate generation image interaction method projection source space target tissue unit volume,0
8965818,diagnosis disease factor information knowledge method model multi patient plurality record relationship step system view,0
10951597,acquisition client imaging invention location method network secure site system view,0
10671659,file image item memory method processor set storage system,0
10213149,computer determine function group item level measure medium method part person processing product program representation response score system,0
9524372,device example flow generate identification information method network patient result sample system test,1
