patent_number,text,promising
10636516,analysis assessment client communication computer device display embodiment generate healthcare information input medium object patient plurality profile selection status system time treatment user,0
9305140,care database delivery determine engine form health information method network section state status store subject system treatment,1
10417446,apparatus body care computer data detector event information management medium method monitor patient processor storage store unit use,1
11170881,care communication device display example healthcare information instruction method monitoring output patient portion provider space store system user,0
10665334,care code computer diagnosis disclosure flow health healthcare information medication medium method monitoring part patient plan product program provider record response service system,0
10042979,access action command data device display healthcare information input method patient processing provide result screen system user value,1
8805900,apparatus care computer determine device health healthcare information item location memory method patient processor product program query system value,0
10217527,access action command device display event healthcare information input method monitoring patient portion processing representation screen system user,0
10366204,healthcare method platform process processing system,1
10068057,access action command device display healthcare information input method patient processing region set system user,1
9330236,condition criterion health healthcare indication information method patient rule service source system,1
11087878,apparatus configuration connection database environment example healthcare interface machine message method pattern plurality source system target,0
11004547,application device environment generate healthcare interface method model plurality record source store system user,0
10424033,application client device example flow form healthcare information management method operation protocol storage system type,1
10902950,data detection example generate healthcare patient plan plurality program provider response source view,0
8751262,care code criterion database document generate health information instruction item memory method part patient process quality record rule score store system,0
10541054,communication computer data database display element generate healthcare interface intervention method network order patient plurality portion query result source support system term user,0
10671702,action area care condition database device entity event healthcare identity input interface management method patient procedure record response rule system tag,0
9953385,attribute computer dataset healthcare measure method patient plurality provider quality rule system,0
11185227,body caregiver cloud diagnosis disease embodiment engine health intervention method monitor monitoring multi parameter patient person platform plurality report sensor server system value,0
9734287,access application care communication computer disclosure health information management method software system,1
10943679,apparatus computer generate healthcare information input instruction knowledge memory method processor record resource service term,0
11127502,account analysis apparatus computer diagnosis form healthcare information instruction knowledge memory method object patient perform processor resource service,0
9323894,access area care detection detector device health identity module monitoring operation patient perform presence system task,1
8392219,claim computer healthcare identifier information method part patient pharmacy portion prescription process product program request system,0
10482385,algorithm analysis aspect computer condition diagnosis drug generate healthcare medium model network patient plurality relationship selection system treatment,0
8930214,camera computer connection device display function group information input instruction management medium memory plurality procedure processor record resource system video,1
10380547,healthcare information member method network system transaction user,0
10453563,care computer database event facility health message method patient record rule text transaction,0
10592501,accordance alert care communication database drug effect food generate health information method patient platform plurality processing program record system tool user,0
11200966,association database device factor healthcare information instruction location method prediction record risk store system,0
11043293,device diagnosis display embodiment field form healthcare information input interface list medication output prescription processor provider treatment user,0
9710600,apparatus computer health healthcare management medium method program provider record storage system time,1
9536049,access aspect command diagnosis healthcare identity information interaction interface language management medication patient record representation system task treatment user,1
8515777,cost healthcare model outcome patient point resource result service system,1
11177031,access action application association cause computer device healthcare information input network order perform plurality process system,0
8825775,apparatus entity example healthcare identification information message method plurality system type,0
9996664,combination configuration content entity healthcare message method record rule system,1
10600516,administration care case disease emergency healthcare invention level management member method patient plan resource risk room,0
11037659,accordance aspect decision generate healthcare node record result support,0
9582641,access activity alarm control database healthcare method patient plan process provider server service system time user,0
10318635,code collection condition database distribution entity field healthcare information number service store system transaction,0
8660857,feature generate group measure method model outcome output patient population query recommendation record representation system,0
9846850,action client device entry event example facility healthcare information patient plurality request schedule system,0
10943676,action cause entity generate group hospital information instruction item output patient probability system technology,0
10565315,code collection condition database distribution field healthcare information number service store system transaction,0
8930471,computer end environment example field healthcare interface message method number point service structure system,0
11101044,action communication database example healthcare method parameter patient plan provider record response service system time,0
11049617,access cause communication device drug environment healthcare hospital identification information interface method network patient step tag,0
8321243,claim computer healthcare information method part patient product provider request system transaction,1
10650478,application computer generate healthcare information medium method record representation source storage structure system time,0
10978197,care generate health healthcare information patient provider record service system use,0
10510439,generate healthcare indication information method patient plurality processing provider relationship system,0
9934361,generate healthcare method model party platform prediction set source use,0
10692589,action apparatus basis care communication computer group health input management method network output parameter platform plurality processing processor product program relationship state storage store structure system treatment,0
10957451,access algorithm apparatus communication condition database determine device effect engine example health healthcare information interaction interface machine method model patient plan rate selection server system treatment,0
11056237,activity care comparison display event health healthcare instruction method patient plan processor representation system treatment value,0
8630842,action computer display healthcare input method plurality record selection service target user,0
10957435,alert care computer decision health healthcare interaction machine message model order patient provider system target time treatment use,0
10902090,care cost hand health healthcare intervention level method order patient sensor system technology,0
10691774,care cost device effect embodiment factor health healthcare information list medication method platform prescription process query selection storage system user,0
8990834,application communication component controller engine function healthcare information interface method party server system transmission,0
8738398,apparatus disclosure distribution drug embodiment information method outcome patient prescription system,0
11096577,care communication criterion engine health information notification party patient rule set status system time,0
8996584,application content delivery example healthcare identifier item location management method plurality provide relationship service source system target,0
10869601,access care computer condition criterion diagnosis entry health monitor monitoring part record secure step system time treatment,0
10902945,activity analysis caregiver condition decision diagnosis disease entity example facility health healthcare hospital index measurement mechanism outcome patient provider report study system technique treatment,0
10303851,access application care communication computer database delivery device diagnosis health information patient platform recommendation server system time treatment,1
9734290,account analysis body computer cost disease health healthcare index interaction model plan program provider record system time,1
8930222,action comparison criterion disease health healthcare management method patient profile status system,1
9734512,adherence assessment computer condition cost database decision device form invention medium method model number outcome output performance point process processor protocol provider series service software support system time tool treatment,0
10847256,access change communication computer database health healthcare information interface management method multi network party patient plurality product program provider record security server service system,0
10818383,care database distribution entry feature healthcare hospital identifier information method patient unit,1
10403391,code distribution entity healthcare information map processor service system value,0
11087886,application cause device disease facility health healthcare indication location notification patient person portion record system,0
10340038,care device health healthcare input method outcome output parameter person system transaction,1
11158418,apparatus communication embodiment healthcare interface machine message method network record segment service system type,0
10437960,apparatus care change computer device display facility health healthcare information input management method output patient plurality processor product program room system,0
10937553,determine entity message method number portion process processing system,0
10522249,access change computer database healthcare information method plurality record report server system tag,0
8494872,computer healthcare information input interface management profile program server service site source system user,0
8392209,apparatus association claim code computer delivery information method part pharmacy portion product request response service support system transaction,0
10977254,action application claim condition criterion embodiment example factor healthcare information level list location network patient procedure provider quality query result score search system term type user volume,0
10720232,access account device document entry event healthcare management module network program record request store system technique user,0
10726152,access application client computer device file health healthcare identifier management patient plurality portion record system technology,0
10909627,access change computer database generate healthcare information method record report server system,0
11056219,access care computer condition device diagnosis display facility health healthcare instruction method plan processor record system treatment value,0
9619849,communication computer content control database delivery device event health healthcare information input interface method monitor monitoring network patient plan process provider record server status system time,1
11126696,component computer cost healthcare method patient perform prediction procedure provide provider recommendation software system,0
10665335,acquisition camera care cloud command device display health image location memory method network record request schedule screen security service storage system,0
10318710,action aspect claim entity healthcare method notification parameter patient processing record system,0
10292653,amount device healthcare information measurement method mode position response sensor state time user,0
10319473,action activity adherence camera combination compliance device hand healthcare management medication monitor movement part performance position sensor system,0
10402927,decision hospital information management patient performance processing protocol record resource structure,0
10354755,area care code condition diagnosis embodiment factor group health method number patient provider score system volume,0
10255337,care circuitry computer context element health information method order plurality processing product program system,0
9633174,account action activity computer connection cost health healthcare information interface member plan product program quality rule system term,0
11107576,access care communication computer information message method order patient prescription provider record system text,0
8984583,access action compliance computer control healthcare method plurality processor record user,1
8700427,care claim computer cost database function healthcare input invention management medium memory message method notification perform processor product program report service system user,0
10528913,care compliance context decision device facility indication information item management performance protocol record resource result sensor status structure,0
8521564,collection control database healthcare information interaction interface patient point question technology tool,1
9642967,caregiver communication compliance connection device display hand healthcare monitor monitoring patient protocol support system use,1
10318915,application change code drug environment hand healthcare identity location machine mechanism patient process product provider record sample series system time transaction,0
10446274,analysis apparatus basis case cloud health healthcare information management method platform provider record result service,0
9202066,care communication database determine health method patient plurality processor relationship set store system,0
10910106,body care device embodiment feedback health heart location monitoring movement number parameter patient platform rate sensor software state system technology temperature time,0
10847265,area classification device diagnosis disease embodiment healthcare image instruction memory method processor recommendation step system technique treatment user,0
9875450,activity area assessment engine event facility healthcare information interface level list method network plurality point provider quality report resource sensor server storage store subject system time user value,1
11071454,apparatus device facility healthcare identification identifier label location machine plurality sensor server support system,0
10424031,application code computer context device display healthcare image information operation processor resource response session system text,1
9819650,analysis application device environment healthcare interface method network plurality portion query result secure server session source space system,1
10111591,element environment feedback health healthcare instruction interface measurement memory method module monitor monitoring patient processor sensor status system time,1
11049600,communication device distribution drug environment healthcare network patient server system use,0
9959385,access algorithm care communication computer embodiment entity health healthcare message part process provider system transmission user,1
9075869,access analysis collection engine file health healthcare intervention management method person process processing rule source step system use,1
10120977,access base communication device embodiment facility healthcare information location management patient perform procedure provider record secure security server site system,0
10456078,activity analysis care device display health motion risk sensor system user,0
10535995,activity amount apparatus control detection determination determine device display environment healthcare instruction instrument measure measurement memory power result system unit,0
9456958,access device embodiment healthcare identity monitoring network notification report system tag time transmit,1
10719222,display engine healthcare medication method patient portion position provider system text tool,0
10438149,care comparison computer delivery determine disclosure embodiment health healthcare information medium patient process result screen system time value,0
10366205,communication control device hand health management monitoring patient plurality processor sensor service sign station system unit,0
9779407,agent change computer control diagnosis group healthcare instruction network parameter point prescription product provider rule service software target time treatment,1
10685413,account communication contact content example healthcare information list medication message method notification party plan response source system text user,0
8745413,care data form health healthcare information message query record result search segment system value,0
11144825,care combination health healthcare information machine method model network prediction processor result training,0
8781852,attribute care collection field form health invention location object request store system user,0
8902278,device embodiment facility health healthcare information level map method network patient plan plurality region representation room system user view,1
9268912,care combination communication content control drug entity facility health item machine management memory part pharmacy prescription site system user,1
9953181,access code computer healthcare identification information instruction item location medium method plurality secure security sequence storage system time user,1
9824184,healthcare interface method object platform representation rule sensor system type,1
9846525,access control device facility interaction location management user wireless,0
9642529,area care condition device health indicator measurement movement network notification output power processing sensor sign source status storage system transmit user,1
10095835,analysis apparatus healthcare management network system,1
10255996,condition display effect example healthcare indication information method operation processing provide request response system transaction,1
11087888,area communication criterion database disease facility healthcare identification information instruction location map medium method mode node object perform person processor storage store system tag time transmission,0
9729833,alert determine display hand healthcare measure method monitor monitoring notification patient person remote room service step system video,1
10315851,administration apparatus area device distribution embodiment facility healthcare location medication method patient person pharmacy storage system unit,0
10692592,association computer healthcare medium method node platform processing service source storage store system term,0
8783566,access camera control form healthcare image information invention model prescription request screen service use,0
8688468,computer dosage healthcare information method part patient product provider system transaction,1
10586622,care disclosure health healthcare information management method network outcome patient provider relationship system,0
10770176,attribute control display health healthcare list measure method relationship system tool value,0
10319469,accordance change computer delivery healthcare location medium method node processing record rule source system type use,0
8209194,data end healthcare management method network part party patient process profile provider service system,0
11037676,association component computer determine device embodiment entity facility healthcare information location management medium patient system time,0
11200985,collection computer database document frequency healthcare level method parameter product program search study system term,0
10842378,analysis application care computer device diagnosis examination function health healthcare invention model multi perform pharmacy point prescription provide server service state system use,0
9947061,account amount device healthcare information management message network prescription procedure protocol provider state system transaction value,0
10512401,alarm alert care communication computer condition form image message method patient profile provide secure system text time,0
9727937,access area care computer determination embodiment health information invention patient provider record secure system,0
8327020,comparison computer healthcare identifier method part request source system transaction value,1
10529446,care communication determine device health management mechanism monitoring output patient plan result session system,1
10923231,accordance assessment care condition health information mechanism patient plurality selection sequence,1
11107561,alert algorithm caregiver comparison database device feedback generate healthcare method model notification period person platform protocol server store system time view,0
9881024,application camera care comparison condition database determination device evaluation health healthcare image indication method object patient plurality processor result,0
10127359,action aspect computer display embodiment engine healthcare input invention medium parameter patient population provide representation request system vector,0
10373712,access computer cost healthcare management medium method processing source storage store system term type,0
8633816,area condition contact control item location method monitoring patient room store system,1
10497475,communication device health healthcare model monitoring sensor service signal technology,0
10780023,computer healthcare management medium service system,0
10912519,combination device display health healthcare machine method processing server system training,0
8666771,analysis area care configuration database display facility health healthcare image location map monitor output plurality population protocol representation service set store system tool video,0
11205510,access aspect connection device embodiment facility healthcare level location management method network region representation rule system tool user view,0
11080793,analysis claim decision group healthcare machine management method model profile provider request result,0
8244556,field healthcare information method part plurality system transaction,1
10102340,claim decision healthcare method processing support system,0
9830423,body care communication device health healthcare part patient platform processor signal state storage store system value,1
10509890,communication component database detection device engine healthcare information interface plurality process rule secure,0
9785749,apparatus care condition database engine feature feedback health healthcare interface list machine model provider search term text training treatment user,0
11049618,data environment healthcare information management module plurality processing source system use,0
10025901,client device healthcare identification image record reference service system video,0
9460392,environment healthcare information management method module plurality processing source system,1
10621491,event healthcare method monitoring network patient risk score sign,0
10320903,capture care case communication content cost decision delivery disclosure healthcare management medium model platform product provider secure software store system tool use user value video,0
11017897,device health healthcare identifier location management method network object record sensor system type use,0
10955995,amount area care change compliance device display emergency event field image indicator information interface management method protocol system task text time user view,0
10423759,assistance comparison determination determine healthcare method product record request response service system time transaction,0
11069437,computer end healthcare information message patient procedure provider server service system,0
9317659,area computer condition health healthcare list management monitoring operation procedure risk sensor system,1
10546102,data decision engine factor generate healthcare item list mechanism model patient probability processing recommendation record risk score system,0
8548839,care communication computer cost event health healthcare management method patient service system,0
11107562,area care device example health machine patient provider service technique,0
10380497,dataset distribution healthcare input method model number parameter range system value,0
