patent_number,text,promising
10755125,basis camera decision disclosure factor frame function heart location measure method monitoring movement parameter provide quality rate signal system video,0
10402542,activity attribute element environment interface monitoring person portion position system,0
11182682,base computer disclosure event interface knowledge method pattern system text,0
9345453,analysis area change interest measurement region surface system volume,0
11129770,case communication compliance configuration detection embodiment interface medication module monitoring output plurality process product sensor state unit value,0
11103153,circuit communication display evaluation function heart image imaging measure measurement model patient plurality processor resonance series session time tissue,0
11210918,algorithm communication component computer device entity frequency identification information monitoring operation patient processor request response signal software system time use,0
10753996,acquisition apparatus change equipment event image imaging input measure method operation parameter protocol quality resonance rule software,0
10905384,alarm basis body classification detection health monitor output parameter plurality relationship section state status type value,0
10105107,disclosure display embodiment image information input method output screen sensor system time,0
9078565,display image interface patient perform processing provide system task user,1
9582683,apparatus code health information instrument management memory method number security server type,0
11058322,body communication display example field information location method part patient pill site system time transmit use,0
8866608,condition database facility information location management method structure,0
11189379,data disclosure generate method node output procedure process structure system,0
8265224,blood content contrast detection detector device flow image information parameter pixel portion ray response sequence system vessel,1
9572528,algorithm determine device example factor information level method monitor monitoring plurality position presence processing result risk sensor system temperature unit,1
10932726,analysis change condition criterion determine device energy event frequency generate information monitoring output parameter patient plurality process processor provide relationship sensor signal status,0
9943280,analysis cause image imaging information instruction marker medium method model perform processor profile projection support surface system,0
11194860,candidate diagnosis disease embodiment generation information knowledge method patient process question score system,0
11033251,criterion feature image input instruction memory method model output processor profile segment system user,0
9993211,detection image marker method model plurality report system,0
11013597,circuitry communication component control electrode embodiment energy frame heart parameter plurality system transmission unit,0
10248756,generation image patient selection,1
10216376,apparatus image imaging interface method patient point position region,0
10769242,candidate cell database disease drug effect engine entry event generation indication item method number portion record system treatment value,0
8835858,body energy heart image interest method person plurality region system,0
10424411,blood cancer detection feature image method patient plurality score test volume,0
10698055,apparatus input method network output parameter resonance sequence,0
10922816,combination image measurement network output sample segment task training,0
10345132,field flow fluid image multi,0
9945922,apparatus area capture detector examination imaging monitoring motion patient position sensor unit,0
10346751,node plurality rule store type,0
9259200,area control image interest method motion patient portion radiation ray sequence system,1
10467741,determine image index method patient protocol quality radiation task therapy,0
9839354,apparatus connection device emergency information method network response server station system target,0
8825139,action agent blood contrast detection event examination image intervention invention measure method model patient position region representation section system vessel,0
10758200,feature flow image interest method parameter patient portion region representation set structure system vessel view,0
10332305,algorithm analysis embodiment generate image interest structure surface technique volume,0
9610026,apparatus circuit detector device distribution event heart measure measurement method patient period plurality process range status target time value,0
11164313,assistance basis device diagnosis disease heart image information invention method model network target,0
11016080,blood case computer criterion device event example invention level measure measurement method number parameter plurality processor product program range storage store tag time unit value,0
9603526,action analysis body circuit cloud communication database device display indication memory method monitoring outcome output platform presence procedure processing record region sensor status storage store system time,0
10674922,acquisition blood body device hand invention level method part patient pressure rate sensor sign temperature unit,0
10783993,amount component controller determine device feedback indication input instruction method monitoring operation part portion result system use,0
10674943,analysis brain caregiver change comparison disorder environment example feedback field form information level measure method monitor performance response system test time,0
9986923,area camera embodiment frame image interest method parameter processing range region series signal subject system time video,0
10039468,analysis disclosure example function method property signal system technique,0
10216905,apparatus case cause determination disease document health monitor state technique,0
10930399,drug engine entity knowledge medium method monitor number processor report search system,0
10791931,amount brain code computer control delivery device imaging interest measure portion program region response series signal system value,0
9495658,apparatus component display generate identification information method processor rule set system,0
11024027,image method network output property system vector,0
9563979,apparatus image imaging location method model processing space unit,0
10839707,communication device environment feedback interface memory output plurality processor program provide response sensor system therapy time user,0
9965675,analysis detection disclosure environment example generate input interaction machine response session vector,1
9468394,amount blood circuit component computer flow generate image map method program system vessel,0
10622107,component configuration device example indication interface method representation tool,0
11051779,feature frame image network output plurality sequence system value,0
10258257,apparatus assessment function method patient person platform pressure risk sensor system,0
10610181,image location movement output patient processor structure time,0
10013759,area base device element energy function image method multi processing region target value volume,0
9811913,apparatus comparison computer image information method model movement parameter plurality point program ray record reference region structure target test,0
11191490,assessment computer feature image interest measure measurement model patient plurality,0
10159454,agent comparison contrast detector image information injection interest patient plurality processor protocol range rate region response system time value,1
9974490,apparatus device display examination identification image method object operation resonance unit,0
9655554,change device image invention method monitoring movement time unit,0
10290100,acquisition area computer control diagnosis display image invention method part processing transmission unit,0
10271817,assessment detection flow information location model time,0
10729324,activity body device health input location measurement network parameter,0
11191476,brain effect intervention location method model network patient,0
10806808,basis cancer disclosure index method model patient step system time tissue,0
10366490,area base image information interaction interest interface machine method model plurality process record system training,0
10987088,brain change embodiment fluid method pressure structure system volume,0
10004467,contrast example image instrument location model portion procedure system target task user,1
11115475,communication device energy platform protocol resource software system tissue use,0
8682704,activity embodiment level method system,1
8939373,acquisition case code device example information measure measurement method patient status system unit,1
8840555,display group image interest location method pixel plurality processing processor region series state subject system tissue,0
9872662,basis computer device distribution embodiment energy examination image measurement method point projection property region relationship rule system value,1
9050055,basis contrast control device function imaging input medium method number parameter patient response system test value,1
9524424,body capture function interaction method model motion parameter relationship sensor system,0
9706952,blood comparison detection heart level message parameter performance processor response signal system value vessel,0
10672148,algorithm image method network quality storage transmission,0
10776607,cancer classification computer embodiment feature image machine probability region tissue type,0
11097052,accordance blood delivery determine device infusion insulin method mode operation patient profile target time use user value,0
9713433,activity brain comparison feature method plurality reference region subject system,0
9483621,controller device dispenser information medication memory sensor surface time use user,0
10238454,component measure method patient,0
8438049,computer device diagnosis group instruction method plurality storage system value,1
10979575,alert analysis determination device environment frequency method processor,0
10223640,application base case diagnosis form knowledge memory response user,0
11170891,analysis computer criterion determination generate generation image language method process program report,0
10842933,body collection communication container delivery flow fluid injection medium portion site system use,0
11064918,blood body component determine feature housing invention measure parameter patient portion pressure sensor sign tissue wireless,0
10384006,administration basis care container hospital medication number patient pharmacy prescription system task time use,0
10342620,candidate effect image intervention method model patient signal site treatment,1
10803995,assessment blood flow image index method model patient rate system,0
8630468,area examination generation image imaging method patient point position ray representation result system vessel,1
9646258,circuitry computer decision detection device display embodiment event generate indication medium method model node parameter period record structure subject system technique time,0
10682767,assistance command component device example field imaging information input interface method process user view,0
8925812,device environment frequency identification item list method plurality procedure system tag tool,0
10824695,analysis apparatus configuration control imaging method parameter protocol reference,0
10006758,body device image parameter point position projection subject surface system technique,0
10311603,aspect device image method process subject unit,0
10602975,area classification distribution function image level method output pixel power result score system value,0
10354438,activity image information result source,0
10702190,activity amount change device display embodiment information interface memory method module period point processor sensor,0
10539558,blood disease invention level method risk sample score,0
10650061,communication device display element embodiment information instruction interface location medium method plurality processor query request status storage system time user,1
10864059,device distribution form injection invention method part patient tag use,0
11160510,base body device diagnosis image imaging interface method portion procedure quality rule selection store target video view,0
9968274,computer input method plurality processing response system user,1
11058209,algorithm amount analysis apparatus body change device disclosure environment feature image information machine method period plurality value,0
9788767,circuit level multi plurality response substance system tissue,1
10820803,account apparatus communication computer examination information management patient plurality server system test,0
9101334,analysis body cell change condition device display health image information interface level method output result sensor system technology time user,0
11141104,assistance connection control device display electrode frame heart method monitor platform rate structure system,0
9779483,display embodiment identifier imaging measurement method modality multi processing reference region selection system target user,0
9075668,activity apparatus aspect assessment case computer device event memory method module platform plurality processing processor risk server system,1
9432378,communication computer device identifier intervention invention medium message method module network point portion security system time,0
10642953,device display embodiment imaging label method modality multi processing reference selection set system target,0
10575786,analysis assessment device disclosure embodiment feature method model plurality quality sample sensor signal system time training,0
10380322,component engine event health module platform plurality program rule service software system video,0
11139078,determine event generate level management method monitoring period sensor state system type use,0
10957437,adherence event information machine medication medium method monitoring notification system,0
9904766,access communication data device information method patient record request resource server session system,0
10453565,function group message protocol security system target,0
10694962,assessment combination device drug heart invention marker patient risk therapy,0
9186087,electrode frame image method motion position procedure series,0
8897530,area computer contrast dataset device embodiment energy examination image medium method pixel processing product program ray result section system tissue value,0
10542938,area detection detector device element evaluation housing imaging method movement patient unit,0
10835134,amount application device embodiment function invention method subject system use,0
9339257,apparatus factor image information measurement method motion part plurality reference region unit,0
10656229,agent contrast imaging resonance system technology,0
10091578,communication detection examination level method output resonance signal unit volume,0
9380153,action client entity example identification indicator level method network number perform profile service storage system,0
10497470,cause communication controller determine device disease display environment health information memory method output sensor state unit user,0
10182770,activity aspect capture cause communication device environment image instruction memory network parameter plurality position processing program provide sensor server set state system unit,1
9880171,cancer method result state,0
11189365,action area assessment attribute computer determine entity machine method model monitor performance point product program provider score site study system value,0
10360998,data disclosure event information interface object parameter plurality record response system technique time,0
10363008,analysis apparatus area base blood cancer determination example flow generate information input interest method probability region use value,0
10003944,communication control device emergency event generation message method module processor range service transmit video,1
11195611,analysis comparison database diagnosis information instrument location process processor program server system time transmit,0
9804149,aspect display example group information level machine number outcome patient period result rule set storage system test time,0
8837685,client entity example information level message method network part party profile record relationship response service storage system,1
10007709,acquisition basis change device information method processing unit value,0
10540421,analysis basis collection database monitoring pattern plurality score step test type value,0
10223515,algorithm computer data device information processor profile sensor source,0
9092552,action event location memory method module monitor response state system value,0
10915591,acquisition application client control device engine image interface item medium method object selection service structure,0
10628887,account computer event information invention product profile program score system user,0
10736582,analysis condition determine device generate identification information module monitoring person response sensor signal system,0
10448885,apparatus delivery device identifier medication method network remote server status treatment,1
9962509,alarm control device function machine patient period process reference signal time value volume,0
9629615,communication device field heart image machine method mode motion processing set storage store system tissue,1
10332638,agent classification detection feature indication method number patient plurality prediction state system time,0
9741166,generation image method position view,0
10307100,body device feature function method person system,0
10888715,condition determination dosage factor parameter pressure state system tissue treatment,0
9885722,blood level medium method result sample signal test,0
10548533,detection health method monitoring patient segment signal system,0
11013481,blood examination function image method model object provide ray region vessel,0
9721118,access computer data example form index method module network order product program record security source system,0
10268915,detection determine device feature image interest intervention level list method model procedure ray region structure time type,0
10885148,analysis classification code combination display element health interface list location map method patient query record response result selection system user,0
11173259,application code delivery device drug management medication module number power response system time type,0
11020003,application body care caregiver collection command communication configuration connection control file function health indicator information interface location management member message monitoring number operation patient sensor server service software support system,0
10037412,distribution health measurement method score sign state time,0
9936930,apparatus area image method position rate target treatment,0
10548525,administration algorithm blood code computer condition exercise factor instruction insulin level management monitoring product program set subject system therapy,0
9764178,controller decision energy equipment identification input system time,1
10291276,apparatus area connection detection device element examination example interface management mechanism network power presence process room schedule source system transmit,0
10319478,administration computer input management method model parameter patient range system time value,0
9517011,acquisition apparatus association care communication control device information measurement method person processing program result target unit,1
10540911,body device feedback input interaction portion procedure processor provider signal structure subject system treatment,0
10896301,care cell circuit compliance container determine medication method provider system time,0
10943302,analysis computer cost determination device health invention parameter plurality product program risk rule score sensor state step system,0
10340047,computer determine health identification interest invention method number part person product program provide risk system user,0
11026641,amount analysis distribution image interest location method parameter portion region report segment surface system tissue,0
10440017,access adherence apparatus care computer device display health identification invention location medication output product program secure storage system transaction user,0
9536051,analysis care condition diagnosis disease health indication input method output patient probability provider sign,0
11045140,application device evaluation health method monitoring subject treatment use,0
10456332,controller delivery device dispenser distribution dosage form invention mechanism medication plurality station storage system time unit,0
8462927,assistance database function information list method network plurality service system user,0
10885170,data health information medium method module network part patient record score storage system type,0
11096632,body change condition device display method monitoring patient region representation system time,0
10880932,cause communication connection device period technique time,0
9707408,cause communication device embodiment emergency generate instruction message module monitor parameter patient processor remote response system therapy transmit value,0
9060747,computer device frequency interface method monitor movement parameter pattern processor sensor stimulation subject value,1
11116426,circuitry condition controller device input interaction monitor patient time user,0
10956821,embodiment event factor model processor series time,0
9814846,circuit drug example feature information method property system,0
10810855,activity analysis collection control environment event monitoring object person signal system unit,0
8504142,apparatus basis computer method pattern point program risk segment,0
10524680,algorithm application device diagnosis example method result use,0
10276029,compliance embodiment entry event function method number system time,0
10086974,container device method order plurality processing system,1
10523498,database multi network node wireless,0
10966616,application computer condition determination diagnosis heart invention method motion parameter period program rate response signal subject system unit,0
10702173,blood camera change flow heart image interest method plurality rate region segment sequence subject system value,0
10492723,apparatus cancer cell circuitry classification embodiment example feature generate image part patient probability region response segment tissue vessel,0
11185281,combination component delivery device disclosure embodiment information method model monitoring output processor sensor stimulation system time user video,0
10213280,accordance computer condition device disorder example image method model patient program set step,0
10096386,configuration device electrode element map method model plurality stimulation system target,0
11039804,apparatus basis blood condition determine effect examination feature flow image invention method model order parameter performance,0
10368765,acquisition apparatus body circuit device electrode method mode portion sensor signal user,0
10307288,administration apparatus control device fluid management measurement method parameter pressure procedure support temperature tissue use,0
10420886,administration agent connection flow invention multi pressure pump rate segment series system therapy,0
11037681,access alert apparatus communication condition database decision determine effect embodiment environment health information input item method point procedure provide quality score sensor store transmit user,0
11141102,change communication computer disease factor function health information measure medium method model period person processing remote result sample server storage system time,0
10682086,action condition delivery image level message method plurality source state status system type user,0
11027129,application image information interest method model patient point sequence state structure value,0
10679748,capture caregiver communication control controller device display function image interface method network sensor signal system technique transmit,1
9993213,apparatus control diagnosis display energy image management ray region system time tissue,0
8655486,application client information management medication message method process profile structure system transmission type use,0
10058473,amount apparatus detection determination feedback information output period position sensor time training unit value,0
9569586,algorithm cancer cell disease drug element identification invention map mechanism patient pattern prediction process program software system target therapy tissue,1
10223765,apparatus control display image information input method object plurality position processing program region unit,0
8918168,computer electrode interface module portion processing processor signal transmission,0
11049596,computer control data disclosure interface method network plurality provider resource system volume,0
11157700,activity assessment cause condition display element feature instruction level map memory message module point processor state status store system user value,0
10425705,analysis combination communication environment message method notification provide sensor structure system time user,0
