patent_number,text,promising
10210735,alarm apparatus area computer criterion disease facility information invention medium method monitoring plurality processing status system,0
10886011,code compliance condition determination device element evaluation information management monitoring patient plurality record request subject system time treatment,0
10629294,communication control information input mechanism method number patient processor remote system unit,0
11004563,cause collection component computer condition determine device embodiment example management memory monitoring parameter portion processor relationship store system technique treatment,0
11145421,accordance application capture communication computer end information method module network program server storage system user video,0
10470739,apparatus application comparison example imaging management method process protocol storage system,0
8266742,access configuration control device feature input output person,1
10134488,examination example information interface location management mechanism notification patient process processor room schedule sensor system time,1
10925810,adherence case compliance computer dosage event feedback interface medication medium method schedule sensor system user,0
10504379,agent cause determine disclosure display generate information instruction interface machine method parameter plan processor relationship signal system,0
10261961,apparatus cause circuitry client computer data element embodiment event example generate identification method order product program service,0
10438693,claim determination drug embodiment member method notification operation performance plan prescription request status system,0
10475539,application assessment combination decision machine method model outcome patient plurality prediction result risk system treatment,0
10579959,computer entry frequency identification information item location medium method record store system tag unit,0
9576106,care comparison example health image instruction monitoring parameter procedure remote value video,1
11056244,access cause dataset display memory network parameter period procedure processor rate remote server system time transmit,0
10074059,account application care compliance criterion example facility method number operation patient procedure process request schedule score selection service time treatment user,0
9079045,communication computer device interface network patient system task type use,0
10534900,device embodiment information method plurality service step support,1
9427185,care device disclosure feature health model prediction state user,0
11141115,access assessment cause client communication computer condition device display generate image information instruction medium network patient perform portion processing storage system technique use,0
8719712,cause cell computer control device display instruction measure medium monitor monitoring operation parameter patient plurality position screen software storage system unit user,0
9510791,communication computer determine device example form health patient question series server software state,0
9306999,computer embodiment entity example method motion product program provider session system treatment video,0
11158405,access assessment cause client component device display image information management order patient processing response structure system technique,0
10912508,base computer evaluation generate heart indication information knowledge method model output period rate record relationship sample sequence state subject system time training,0
10555704,alert circuit control criterion database detector determine event heart indicator information input machine management method outcome patient plurality query signal system target user,1
10128002,blood communication determine device display dosage information insulin management measurement method patient program time,0
10945600,access application computer device disclosure distribution embodiment health information level method system value,0
8903786,application classification code computer database method portion processor profile result system,0
10886028,apparatus method model patient plurality portion technique text,0
10946382,analysis apparatus blood body cancer detection device disease information intervention invention method monitoring patient profile range resource system technique therapy use,0
10504625,aspect computer database determination invention measurement medium method plan population reference subject system treatment,0
9999744,cause detection determine device disorder information monitoring movement parameter quality record response sensor system temperature therapy treatment user,1
10646166,computer device environment information invention output product program signal user,0
10861605,accordance activity apparatus comparison disease health identification image method number question response result security sequence state status system test video,0
9345645,change compliance dispenser dosage drug emergency level medication performance plan record time treatment use,1
10964417,cause compliance database delivery device example field fluid image information interface patient platform portion processor record screen selection system text treatment user,0
10039451,collection detection frequency method monitoring patient sensor status system,0
11152087,analysis computer dataset health information level method processing product program provide quality record report system,0
10521557,apparatus cancer computer detection medium method patient program storage system treatment,1
9747423,activity cause disease exercise indication input order parameter part patient program response state system technology therapy video,0
10311204,entity model parameter period prediction state system time,0
11195600,condition detection disease label plurality record study,0
10354750,access capture care client device facility flow imaging list management method module monitoring outcome patient platform point quality server system,0
10922995,disclosure health method recommendation system,0
11195133,factor group identification level measure population processor risk system target,0
9852272,association device display generation input interaction method order report selection structure system type user,0
8602294,access account code computer device information medium method program segment storage system,1
10052072,area care change computer content device display image indicator medium method output patient point position screen series state time,0
10265219,communication identifier monitoring processor system unit,1
9842374,blood cause condition device disease health indicator input level management parameter patient pressure query rate response result temperature,0
10930398,algorithm care comparison examination health input marker method patient provider result risk sensor,0
8928671,body display embodiment event input location method person quality range time,1
8498884,access computer control database device entity information level management record security storage system,0
10365945,analysis detection event method monitor plurality process processor system,0
8386276,activity claim communication computer healthcare information level measure method number period plurality processor provider request system time transaction,0
10600015,context control detector device input interface measure modality procedure room sensor system,0
11158410,apparatus decision diagnosis generate information medium method plurality process processing selection storage system target unit,0
10558845,apparatus capture computer determination device image interest location medication medium method pill portion position program region step storage user,0
10573413,amount detection determine device example method output patient performance response,0
10646674,aspect configuration determine device generate machine management medium memory method parameter patient processor profile system,0
10685740,control drug embodiment generation information management method monitor system technology treatment,0
9177103,dataset group image input plurality portion study subject system volume,0
10346938,adherence apparatus computer file invention medication method patient prescription substance system,0
9773230,computer configuration embodiment message method product program record report system user,0
9839356,circuitry communication condition device example location method monitor patient remote system,1
10059520,action area combination container determine device distribution evaluation method pill plurality section station system,0
9256645,attribute computer information level patient profile search user,0
9646135,account analysis care cause client communication computer condition cost criterion device factor health information instruction invention list medium module outcome patient plurality population processor program service system treatment value,0
10061894,activity area condition generate group health information management order system,1
10818397,access content decision document engine indication intervention item plurality process reference report response segment support text,0
9788792,area body condition device image invention presence provider risk surface system tissue transmit,0
11031107,accordance evaluation generate indicator information instruction mechanism memory operation parameter patient processing processor query question record result search system value,0
10787714,condition dataset device feature method model output population sample subject system therapy,0
9131903,apparatus blood control display level method plurality program support treatment unit value,0
10741283,indication interface plurality presence region selection study,0
10722180,algorithm analysis condition device diagnosis disease disorder generate image medium prediction system,0
10485431,blood content flow heart index level measure pressure rate record sign system,0
9886550,access communication delivery field healthcare intervention level operation parameter patient perform procedure process pump record task treatment,1
10446270,area association care client computer content device display distribution indicator item medium method output patient plurality point program relationship request screen series server state time,0
8694335,apparatus method part portion set technique text user,1
10493242,device element plurality portion position system,0
11129565,application cancer change component detection feature level method network patient representation segment signal system time tissue,0
8650040,apparatus method patient provider relationship system,0
10872687,cause computer determine information instruction medication medium memory method patient pattern pharmacy prescription processor system,0
10206631,body connection contact device electrode mechanism sensor station system,0
10463300,body combination device embodiment management monitor power sensor state system temperature,0
10204212,administration application interface medication software,0
10833983,care cloud communication cost facility feature hospital network outcome patient platform process provide security service software technology,0
11127495,assessment information input interest interface management method number plan plurality process quality risk step user,0
11101032,algorithm body database examination feature identification image interest machine method part patient plurality reference region representation system,0
10803993,agent control detection device event health indication intervention measure member method person population record risk system value,0
9747415,application attribute database example image information interface model object order patient process relationship set system,0
10832823,access application aspect client component computer controller data embodiment end pattern processor security server service system,0
10827941,acquisition algorithm analysis contact device group healthcare information level location method parameter patient plurality provider schedule selection server system,0
9510790,detection device disclosure information method movement period processor range sensor signal state time user value,0
10387623,control device instruction invention order patient recommendation use,0
9700234,body device element image information label list method number site system,0
10672251,assessment condition context device event example generation health patient record selection system task,0
10846370,alert amount case device evaluation information input method patient response technique time,0
10936180,display information interface point time user,0
10720233,access application care device disease indicator monitor monitoring server time unit,0
9075909,attribute communication computer detection determination device disease information instruction location medium operation perform period person portion probability response store system user,1
10325678,delivery drug label method order patient plurality process result selection store subject system,0
9507486,access activity application base basis computer context device input instruction interface memory method perform person plurality processor result screen step system type use user,1
9244528,assistance care caregiver cell communication computer form hospital image location patient question request screen system time type,0
10265010,alert condition device example facility generate information mechanism method monitoring parameter patient position protocol sensor system use,0
10671703,amount care claim computer data determine embodiment entity health machine medium order parameter prediction risk security service system,0
9569591,application control display environment hospital information interface process program structure support system user,1
10949602,apparatus code diagnosis feedback information instruction medium method model order part patient plurality processor sequence storage system text user,0
10748664,communication computer contact healthcare information invention medium method modality person response system user,0
10095834,access application cloud communication compliance control database device embodiment health information interface location management monitoring platform plurality resource secure security system,0
10754926,comparison computer device event information invention level management measurement method parameter plurality processor product program range selection storage store tag time unit value,0
10922647,administration care cost database detection device drug food identification item map number patient system tag time treatment type,0
10028857,assessment care computer condition device display generate information location management medium method module output software surface system treatment type,0
10254910,attribute device display image information list mode system,0
10366424,code engine form generate interface language patient portion position response selection system technique text use user,1
9675264,combination condition configuration detection device electrode feature form heart method monitoring sensor signal surface system therapy vector wireless,1
9585616,brain care cell compliance determine disorder environment example identification identity location method monitoring parameter party patient pattern provider report sensor system technique treatment,1
9619627,care collection device disease health method processing report result sample site step subject system,1
9480435,health indicator interface monitor monitoring output patient range signal status system value,1
9563600,administration communication container device embodiment management medication monitoring network patient pill plurality server store system,0
10424237,apparatus application comparison device display embodiment facility imaging information method program property result system user,0
10789555,computer device health healthcare identification information method product program provider record system time user,1
9129046,database detection feature healthcare index interface management method patient record system technique,1
10951715,display health interface method period response security system type,1
11094401,care device emergency example health hospital identification information mechanism patient procedure provider secure status system transmission,0
8745085,access data method record system,0
10170016,change device health information input management software source system user,0
8626530,application device image medication method number order prescription series service store system time,1
10750961,analysis apparatus assistance diagnosis frequency information measurement medium method output period plurality program result state storage subject time unit value,0
10423761,apparatus computer entity feature field identifier medium method notification product program relationship response set storage system,0
8672874,command communication compliance context device management module protocol support system,1
9314159,alarm alert device level monitor monitoring patient remote system,1
9600850,aspect claim control disclosure information instruction method part product substance system text use,0
10629305,algorithm apparatus association cause computer decision detection example instruction machine memory method model outcome patient processing processor rule set support system,0
9792682,classification detection image invention item level method object ray series software system training,1
11004566,cause detection device evaluation measurement method patient report system,0
11170499,algorithm computer data device evaluation examination image input item measure method patient process program quality record selection target,0
9798778,case database decision method support system value,0
9690903,access apparatus application association computer content image medium memory method system,0
9734474,data element function information medium method plurality reference state system time,0
10810323,caregiver database device disclosure entity healthcare number provider study transmit user,0
11031112,communication contact database device emergency entry generate identifier information patient store system technology,0
10821229,controller delivery device method module monitor point rate sensor system time,0
8618918,access apparatus care circuitry client communication connection control example facility frame hospital interface message movement network node program software support system user,1
11030081,application client configuration device environment interface method network patient resource service software test,0
11189378,action context control disclosure embodiment equipment instrument interaction level method module operation patient process reference report service system training,0
9544151,access method resource response,0
10452816,component embodiment engine input interaction method model patient plan system,1
9946839,base diagnosis embodiment engine facility factor healthcare location patient procedure provider query rate result search system treatment user,1
11183302,care caregiver computer condition decision determine diagnosis disclosure feature health information medium patient pattern result sequence service storage support system,0
10750955,computer condition configuration device display health information memory monitoring processor program sensor storage store,0
10096383,analysis generate health healthcare measurement movement pattern pressure result user,1
8788290,collection communication data disclosure document engine form group information management method order patient query record report request server system time,0
10485458,blood collection device measurement method parameter period plurality profile server time,0
10784000,action apparatus classification device example generate instruction interface language method network output process processor record system vector,0
10552575,client database device identification image information medication monitoring plurality portion prescription system,1
9198623,access application body device feature level management measurement method monitoring processing system user,1
10299735,action diagnosis end feature information machine number part population request sample sensor subject system technique,0
9526457,computer detection disorder engine feature image marker part processor product program region system,0
9795298,application client communication computer condition device form information input method network processing server software system wireless,0
10409954,content disclosure health information method user value,0
8880454,client communication component configuration content context decision engine evaluation health parameter patient provider recommendation record request rule server source support system,1
11049595,aspect computer entry field memory method patient plurality procedure report system,0
10937526,assessment condition determine evaluation feature language mechanism patient processing question record response result value,0
10185923,capture case computer form interface medium range record report selection system time user value,0
10810906,access account care provider system,1
8694333,computer diagnosis member method outcome patient person product program rule system test tool,0
10610302,assessment combination disease effect feedback function imaging information modality mode output patient therapy,0
10064551,action apparatus caregiver collection communication comparison compliance condition device disclosure drug example facility health identification information interface monitor monitoring network parameter patient processing status system therapy transmission value,0
11165909,account amount configuration contact diagnosis file generate healthcare identification level member network point process score secure system time,0
10811131,database device generate group information interface patient plurality set source system therapy,0
8958112,accordance candidate control determination drug information injection instruction label method prescription process program,1
11101028,access computer determination device engine information interface memory method monitor output perform plan prediction range response session system treatment user,0
11081215,candidate computer disease example generate generation invention level list machine method model part patient plurality processor product program record system technique training,0
10332626,capture generate method module plurality process processing sensor system,0
9974512,base cancer component computer decision information method product program provider radiation risk score study system test time use,0
10216906,camera capture communication computer device display instruction medium module network processor system transmit video,1
10217528,action apparatus change distribution example function healthcare management method plurality point probability procedure protocol risk schedule state system task,0
11170445,account amount feature health healthcare information interface method model prediction resource system technology user vector,0
9572484,analysis change detection device display evaluation function healthcare interaction method network patient performance process provider result sequence server service system test treatment user,1
8799011,action apparatus change communication control device display facility function health healthcare information interface list management module patient person remote room status system,1
10770181,data device disclosure event healthcare information map method model notification plurality recommendation resource server structure system technology transaction,1
9703931,access care database device function health healthcare identification interaction interface intervention method object patient presence provider system time,1
11017906,claim code computer data facility healthcare location machine method model prediction procedure result service source value,0
10606983,basis condition criterion diagnosis health healthcare information medication member patient plan population procedure processing program quality source system,0
10650558,event method source system target technique,0
8725532,claim computer determine distribution drug healthcare level management method monitoring notification part processor provider service substance system transaction view,1
9953041,apparatus device entity item method plurality service source storage store term,0
9053214,apparatus device information invention method pattern user,0
9009075,access application command content data detection embodiment image memory method module order product record section secure security source system user,0
8622899,analysis blood heart index method monitor monitoring person pressure rate set,1
10783799,adherence apparatus care facility healthcare location medication method network patient plan provider sensor system technique treatment,0
9013299,facility method patient sensor system time,1
10614634,capture detector image map method motion number parameter pixel plurality projection radiation region result source system volume,0
10650923,collection determine engine feature form image imaging instruction mechanism memory modality mode operation output plurality processing processor result selection structure study system,0
9990581,amount assessment blood computer determination dosage event group insulin method outcome patient plurality range recommendation response system target value,0
10438347,comparison control diagnosis evaluation health modality part quality record report section source system test value,0
10970789,analysis database diagnosis information input method output patient procedure result system treatment user,0
